game_id,title,released,price,overall,positive%,reviews,tags
1623730,Palworld,"18 Jan, 2024","385.000,00₫",Very Positive,0.94,244291,"Multiplayer, Open World, Survival, Creature Collector, Open World Survival Craft, Crafting, Co-op, Adventure, Sandbox, Third-Person Shooter, Automation, Action, Early Access, RPG, Anime, PvE, 3D, Indie, Looter Shooter, Hack and Slash"
1203620,Enshrouded,"24 Jan, 2024","385.000,00₫",Very Positive,0.86,38534,"Open World, Survival, Base Building, Multiplayer, Online Co-Op, Crafting, Action RPG, RPG, Adventure, Building, Singleplayer, Exploration, Early Access, Fantasy, Character Customization, Sandbox, Action, PvE, 3D, Indie"
2670630,Supermarket Simulator,"20 Feb, 2024","180.000,00₫",Very Positive,0.94,12557,"Simulation, Economy, Management, Immersive Sim, Trading, Capitalism, Building, Singleplayer, First-Person, Life Sim, Sandbox, 3D, Casual, Resource Management, Driving, Realistic, Indie, Multiplayer, Inventory Management, Early Access"
899770,Last Epoch,"21 Feb, 2024","445.000,00₫",Mostly Positive,0.77,78041,"Action RPG, Loot, Hack and Slash, RPG, Isometric, Multiplayer, Action, Adventure, Co-op, Indie, Dungeon Crawler, Singleplayer, Top-Down, Early Access, Gore, Violent, Fantasy, Character Customization, Magic, Time Travel"
252490,Rust,"8 Feb, 2018","510.000,00₫",Very Positive,0.87,853593,"Survival, Crafting, Multiplayer, Open World, Open World Survival Craft, Building, PvP, Sandbox, Adventure, First-Person, Action, Nudity, FPS, Shooter, Co-op, Online Co-Op, Indie, Early Access, Post-apocalyptic, Simulation"
108600,Project Zomboid,"8 Nov, 2013","260.000,00₫",Very Positive,0.94,214371,"Survival, Zombies, Open World, Open World Survival Craft, Multiplayer, Sandbox, Post-apocalyptic, Co-op, Crafting, Indie, Building, Simulation, RPG, Survival Horror, Realistic, Isometric, Singleplayer, 2D, Adventure, Early Access"
413150,Stardew Valley,"26 Feb, 2016","165.000,00₫",Overwhelmingly Positive,0.98,558601,"Farming Sim, Life Sim, Pixel Graphics, Multiplayer, RPG, Relaxing, Agriculture, Simulation, Crafting, Sandbox, Indie, Building, Singleplayer, Casual, Open World, 2D, Cute, Dating Sim, Great Soundtrack, Fishing"
2427700,Backpack Battles,"8 Mar, 2024","180.000,00₫",Overwhelmingly Positive,0.95,4001,"Early Access, Auto Battler, Strategy, Inventory Management, PvP, Multiplayer, Roguelike Deckbuilder, Asynchronous Multiplayer, Indie, Tactical, Card Battler, Combat, Loot, Turn-Based, Roguelike, Replay Value, 2D, Hand-drawn, Cute, Cozy"
227300,Euro Truck Simulator 2,"12 Oct, 2012","280.000,00₫",Overwhelmingly Positive,0.97,550725,"Driving, Transportation, Simulation, Open World, Automobile Sim, Realistic, Moddable, Relaxing, Immersive Sim, Exploration, Economy, Management, Atmospheric, Multiplayer, Controller, Family Friendly, Third Person, Adventure, Casual, Indie"
294100,RimWorld,"17 Oct, 2018","350.000,00₫",Overwhelmingly Positive,0.98,151940,"Colony Sim, Base Building, Survival, Strategy, Sandbox, Management, Building, Simulation, Singleplayer, City Builder, Moddable, Open World, Procedural Generation, 2D, Sci-fi, Indie, Space, Tactical RPG, Western, Cartoony"
1868140,DAVE THE DIVER,"28 Jun, 2023","260.000,00₫",Overwhelmingly Positive,0.97,86971,"Pixel Graphics, Casual, Adventure, Management, RPG, Relaxing, Fishing, Simulation, Exploration, Underwater, Singleplayer, Farming Sim, Crafting, 2D, Roguelite, Story Rich, Funny, Agriculture, Indie, Action"
105600,Terraria,"16 May, 2011","142.000,00₫",Overwhelmingly Positive,0.97,1005611,"Open World Survival Craft, Sandbox, Survival, 2D, Multiplayer, Adventure, Pixel Graphics, Crafting, Building, Exploration, Co-op, Open World, Online Co-Op, Indie, Action, RPG, Singleplayer, Replay Value, Platformer, Atmospheric"
648800,Raft,"20 Jun, 2022","188.000,00₫",Very Positive,0.93,258264,"Survival, Multiplayer, Open World Survival Craft, Co-op, Crafting, Open World, Building, Base Building, Online Co-Op, Adventure, Sandbox, First-Person, Singleplayer, Early Access, Underwater, Simulation, Action, Indie, Strategy, Massively Multiplayer"
1260320,Party Animals,"20 Sep, 2023","310.000,00₫",Mostly Positive,0.76,32496,"Casual, Multiplayer, Funny, Cute, Party Game, Action, Fighting, PvP, Co-op, Party, Family Friendly, Online Co-Op, Physics, 3D Fighter, Local Multiplayer, 4 Player Local, Indie, Team-Based, Local Co-Op, Action-Adventure"
250900,The Binding of Isaac: Rebirth,"4 Nov, 2014","165.000,00₫",Overwhelmingly Positive,0.97,252453,"Action Roguelike, Roguelike, Indie, Replay Value, Difficult, Pixel Graphics, Dungeon Crawler, Great Soundtrack, Singleplayer, Dark, 2D, Remake, Local Co-Op, Gore, Procedural Generation, Roguelite, Atmospheric, Action, Co-op, Horror"
221100,DayZ,"13 Dec, 2018","1.000.000,00₫",Mostly Positive,0.76,317869,"Survival, Multiplayer, Zombies, Open World, Action, PvP, Shooter, Massively Multiplayer, Horror, Post-apocalyptic, Simulation, FPS, Early Access, First-Person, Survival Horror, Sandbox, Adventure, Co-op, Atmospheric, Indie"
431960,Wallpaper Engine,Nov 2018,"70.000,00₫",Overwhelmingly Positive,0.98,701671,"Mature, Utilities, Software, Anime, Design & Illustration, Animation & Modeling, NSFW, First-Person, Indie, Memes, Cute, Action, Singleplayer, Funny, Early Access, Photo Editing, Sandbox, Horror, Game Development, Gaming"
264710,Subnautica,"23 Jan, 2018","385.000,00₫",Overwhelmingly Positive,0.96,237380,"Open World Survival Craft, Survival, Horror, Open World, Exploration, Underwater, Crafting, Base Building, Singleplayer, Adventure, First-Person, Sci-fi, Sandbox, Atmospheric, Aliens, Survival Horror, Multiplayer, Action, Indie, Early Access"
242760,The Forest,"30 Apr, 2018","188.000,00₫",Overwhelmingly Positive,0.95,451286,"Open World Survival Craft, Survival, Open World, Horror, Crafting, Adventure, Building, Survival Horror, First-Person, Action, Exploration, Sandbox, Singleplayer, Atmospheric, Simulation, Gore, Realistic, Indie, Zombies, Early Access"
2273430,BlazBlue Entropy Effect,"14 Feb, 2024","260.000,00₫",Very Positive,0.92,13313,"Action Roguelike, Metroidvania, Action-Adventure, Platformer, 2D, Action, Pixel Graphics, Replay Value, Procedural Generation, Roguelite, Indie, Beat 'em up, Cyberpunk, Post-apocalyptic, Story Rich, Multiple Endings, Roguelike, 2D Fighter, Roguevania, Anime"
686810,Hell Let Loose,"27 Jul, 2021","900.000,00₫",Very Positive,0.84,76743,"Shooter, World War II, Realistic, FPS, Multiplayer, War, Action, Singleplayer, Military, Tactical, Simulation, First-Person, Massively Multiplayer, Gore, Strategy, Historical, PvP, Mature, Violent, Indie"
739630,Phasmophobia,"18 Sep, 2020","160.000,00₫",Overwhelmingly Positive,0.96,539809,"Horror, Online Co-Op, Multiplayer, Psychological Horror, Co-op, VR, Supernatural, First-Person, Investigation, Dark, Demons, Detective, Mystery, 3D, Early Access, Thriller, Indie, Action, Tactical, Singleplayer"
1943950,Escape the Backrooms,"11 Aug, 2022","120.000,00₫",Very Positive,0.91,52213,"Horror, Multiplayer, Online Co-Op, Psychological Horror, Co-op, Survival Horror, First-Person, Exploration, Adventure, VR, Action, Indie, Escape Room, Early Access, 3D, Singleplayer, Action-Adventure, Casual, Stealth, Dungeon Crawler"
1145360,Hades,"17 Sep, 2020","321.000,00₫",Overwhelmingly Positive,0.98,227668,"Action Roguelike, Roguelite, Hack and Slash, Indie, Action, Mythology, Roguelike, Great Soundtrack, Singleplayer, RPG, Story Rich, Dungeon Crawler, Replay Value, Isometric, Difficult, Action RPG, Hand-drawn, Atmospheric, Perma Death, LGBTQ+"
588650,Dead Cells,"6 Aug, 2018","220.000,00₫",Overwhelmingly Positive,0.97,127164,"Adventure, Action Roguelike, Pixel Graphics, Metroidvania, 2D, Roguelike, Souls-like, Roguelite, Hack and Slash, Replay Value, Difficult, Platformer, Roguevania, Singleplayer, Action, Dark Fantasy, Atmospheric, Procedural Generation, Funny, Indie"
322330,Don't Starve Together,"21 Apr, 2016","165.000,00₫",Overwhelmingly Positive,0.95,302331,"Survival, Open World Survival Craft, Multiplayer, Co-op, Open World, Adventure, Crafting, Online Co-Op, Sandbox, Difficult, Indie, 2D, Atmospheric, Funny, Survival Horror, Strategy, Horror, Singleplayer, Action, Roguelike"
275850,No Man's Sky,"12 Aug, 2016","705.000,00₫",Mostly Positive,0.77,222532,"Open World, Open World Survival Craft, Space, Exploration, Sci-fi, Survival, Procedural Generation, Adventure, First-Person, Sandbox, Singleplayer, Multiplayer, Atmospheric, Crafting, Space Sim, Indie, Action, Simulation, FPS, VR"
632360,Risk of Rain 2,"11 Aug, 2020","220.000,00₫",Overwhelmingly Positive,0.96,178945,"Third-Person Shooter, Action Roguelike, Multiplayer, Co-op, Action, Roguelite, Looter Shooter, Roguelike, Loot, Online Co-Op, Shooter, Difficult, Third Person, Indie, Survival, Great Soundtrack, Singleplayer, Soundtrack, Early Access, Bullet Hell"
728880,Overcooked! 2,"7 Aug, 2018","300.000,00₫",Very Positive,0.9,42622,"Multiplayer, Online Co-Op, Local Co-Op, Co-op, Casual, Funny, Cooking, Indie, 4 Player Local, Local Multiplayer, Action, Family Friendly, Cute, Controller, Comedy, Difficult, Singleplayer, Simulation, Strategy, Colorful"
1190970,House Flipper 2,"14 Dec, 2023","438.500,00₫",Mostly Positive,0.77,5559,"Simulation, Building, Design & Illustration, Casual, Relaxing, Sandbox, Destruction, Family Friendly, Immersive Sim, Education, First-Person, 3D, Indie, Management, Singleplayer, Base Building, Colorful, Replay Value, Economy, Realistic"
526870,Satisfactory,"8 Jun, 2020","385.000,00₫",Overwhelmingly Positive,0.97,133394,"Base Building, Automation, Open World, Multiplayer, Crafting, Co-op, Resource Management, Building, Sandbox, Exploration, Adventure, Open World Survival Craft, Early Access, Simulation, Survival, First-Person, Strategy, Sci-fi, Singleplayer, Indie"
892970,Valheim,"2 Feb, 2021","188.000,00₫",Very Positive,0.94,379048,"Open World Survival Craft, Survival, Online Co-Op, Open World, Multiplayer, Building, Crafting, Exploration, Base Building, Co-op, Sandbox, Adventure, Mythology, RPG, Early Access, Action, PvE, Indie, Singleplayer, Third Person"
671860,BattleBit Remastered,"15 Jun, 2023","253.500,00₫",Very Positive,0.89,110321,"FPS, Multiplayer, Shooter, Military, Destruction, Massively Multiplayer, PvP, Action, War, Tactical, First-Person, Team-Based, Combat, Class-Based, Gun Customization, Character Customization, 3D, Indie, Voxel, Early Access"
367520,Hollow Knight,"24 Feb, 2017","165.000,00₫",Overwhelmingly Positive,0.97,301188,"Metroidvania, Souls-like, Platformer, Great Soundtrack, Difficult, 2D, Indie, Singleplayer, Atmospheric, Exploration, Adventure, Story Rich, Hand-drawn, Action, Multiple Endings, Dark Fantasy, Open World, Cute, Controller, Side Scroller"
1332010,Stray,"19 Jul, 2022","379.000,00₫",Overwhelmingly Positive,0.97,121419,"Cats, Adventure, Cyberpunk, Atmospheric, Singleplayer, Cute, Exploration, Robots, Third Person, Beautiful, Puzzle, Horror, Sci-fi, Indie, Dystopian , Open World, Mystery, Action, Colorful, Stealth"
244210,Assetto Corsa,"19 Dec, 2014","260.000,00₫",Very Positive,0.92,91321,"Racing, Automobile Sim, Simulation, Driving, Multiplayer, Realistic, VR, Sports, Moddable, Controller, Open World, Physics, Singleplayer, First-Person, Indie, Replay Value, Action, 3D Vision, TrackIR, Artificial Intelligence"
1721470,Poppy Playtime,"12 Oct, 2021",Free,Very Positive,0.82,70083,"Horror, Singleplayer, Free to Play, Multiplayer, Puzzle, First-Person, Survival Horror, Dark, Mystery, Survival, Psychological Horror, Indie, Lore-Rich, 1980s, Thriller, Atmospheric, Adventure, Action, Cartoony, Action-Adventure"
286160,Tabletop Simulator,"5 Jun, 2015","188.000,00₫",Overwhelmingly Positive,0.96,38204,"Tabletop, Board Game, Simulation, Multiplayer, Sandbox, Card Game, VR, Trading Card Game, Physics, Moddable, 3D, Casual, Strategy, Online Co-Op, Wargame, Co-op, Funny, RPG, First-Person, Indie"
1562430,DREDGE,"30 Mar, 2023","500.000,00₫",Overwhelmingly Positive,0.95,24479,"Exploration, Fishing, Lovecraftian, Adventure, Open World, Mystery, Inventory Management, RPG, Atmospheric, Simulation, Psychological Horror, Horror, Singleplayer, Stylized, Survival Horror, Psychological, Story Rich, 3D, Sailing, Indie"
268910,Cuphead,"29 Sep, 2017","188.000,00₫",Overwhelmingly Positive,0.96,139322,"Difficult, Cartoon, Co-op, Platformer, Great Soundtrack, Local Co-Op, 2D, Hand-drawn, Multiplayer, Indie, Retro, Cartoony, Bullet Hell, Action, Shoot 'Em Up, Singleplayer, Side Scroller, Colorful, Funny, Souls-like"
1476970,IdleOn - The Idle MMO,"2 Apr, 2021",Free,Mostly Positive,0.78,16017,"Idler, Management, Pixel Graphics, MMORPG, RPG, Crafting, Clicker, Resource Management, Sandbox, Free to Play, Multiplayer, Massively Multiplayer, Indie, Casual, Simulation, Early Access, Character Customization, Old School, PvE, Anime"
753640,Outer Wilds,"18 Jun, 2020","319.000,00₫",Overwhelmingly Positive,0.95,53910,"Exploration, Space, Mystery, Story Rich, Adventure, Great Soundtrack, Atmospheric, Puzzle, Open World, Singleplayer, Sci-fi, Indie, First-Person, Beautiful, Horror, Psychological Horror, Epic, Simulation, 3D, Action"
4000,Garry's Mod,"29 Nov, 2006","120.000,00₫",Overwhelmingly Positive,0.96,903860,"Sandbox, Moddable, Multiplayer, Physics, Building, Casual, Singleplayer, Funny, First-Person, Online Co-Op, Co-op, Simulation, FPS, Action, Shooter, Comedy, Indie, PvP, Realistic, Exploration"
1605220,Dune: Spice Wars,"14 Sep, 2023","445.000,00₫",Mostly Positive,0.79,8660,"Management, Singleplayer, Sci-fi, Strategy, RTS, 4X, Simulation, Grand Strategy, Real Time Tactics, Building, Tactical, Economy, War, Diplomacy, Multiplayer, Base Building, Co-op, PvP, PvE, Indie"
2555190,Poppy Playtime - Chapter 3,"30 Jan, 2024","205.000,00₫",Very Positive,0.84,5698,"Adventure, Action, Indie, Horror, Puzzle, Singleplayer, First-Person, Dark, Survival Horror, Jump Scare, 3D, Violent, Mystery, Story Rich, Blood, Psychological Horror, Survival, Gore, Atmospheric, Action-Adventure"
646570,Slay the Spire,"23 Jan, 2019","312.000,00₫",Overwhelmingly Positive,0.97,129123,"Roguelike Deckbuilder, Card Game, Card Battler, Roguelike, Deckbuilding, Turn-Based, Strategy, Singleplayer, Roguelite, Replay Value, Indie, Difficult, Dungeon Crawler, RPG, Mouse only, Great Soundtrack, 2D, Procedural Generation, Fantasy, Casual"
1049590,Eternal Return,"19 Jul, 2023",Free,Mostly Positive,0.78,55114,"Free to Play, Anime, MOBA, Multiplayer, Survival, PvP, Combat, Top-Down, Crafting, Action, 3D, Strategy, Tactical, Character Customization, Indie, Experimental, Point & Click, Early Access, Sexual Content, MMORPG"
756800,Contraband Police,"8 Mar, 2023","385.000,00₫",Overwhelmingly Positive,0.95,12922,"Open World, Action, First-Person, Multiple Endings, Simulation, Realistic, Singleplayer, 1980s, Automobile Sim, Story Rich, FPS, Survival, Management, Action-Adventure, Immersive Sim, Detective, Physics, Destruction, Atmospheric, Indie"
1336490,Against the Storm,"8 Dec, 2023","399.000,00₫",Overwhelmingly Positive,0.95,21060,"City Builder, Strategy, Base Building, Simulation, Building, Resource Management, Management, Colony Sim, Sandbox, Survival, Roguelike, Moddable, Economy, Singleplayer, Open World, Roguelite, 2D, Automation, Fantasy, Indie"
1129580,Medieval Dynasty,"23 Sep, 2021","490.000,00₫",Very Positive,0.9,31250,"Multiplayer, Co-op, Open World, Medieval, Survival, RPG, Atmospheric, Singleplayer, Base Building, Simulation, Realistic, First-Person, Historical, Adventure, Action, Management, Sandbox, Indie, Relaxing, Horses"
1290000,PowerWash Simulator,"14 Jul, 2022","570.000,00₫",Overwhelmingly Positive,0.97,37955,"Casual, Relaxing, Simulation, First-Person, Sandbox, 3D, Multiplayer, Funny, Immersive Sim, Co-op, Story Rich, Family Friendly, Colorful, Online Co-Op, Realistic, Wholesome, Singleplayer, Indie, Cozy, Atmospheric"
513710,SCUM,"29 Aug, 2018","565.000,00₫",Mostly Positive,0.75,80764,"Survival, Open World Survival Craft, Multiplayer, Open World, Zombies, Nudity, Massively Multiplayer, Action, Adventure, Realistic, Early Access, Crafting, Singleplayer, FPS, Violent, PvP, Gore, Third Person, Indie, RPG"
2138710,Sifu,"28 Mar, 2023","373.000,00₫",Very Positive,0.92,8696,"Action, Martial Arts, Beat 'em up, Difficult, Third Person, Souls-like, Singleplayer, Crime, Blood, Swordplay, Indie, Dark, Arcade, Dark Fantasy, Action Roguelike, War, Fighting, Hack and Slash, Action RPG, Action-Adventure"
960090,Bloons TD 6,"17 Dec, 2018","160.000,00₫",Overwhelmingly Positive,0.97,263482,"Tower Defense, Strategy, Multiplayer, Singleplayer, Online Co-Op, Co-op, Family Friendly, Casual, 3D, Cartoony, Sandbox, Great Soundtrack, Difficult, Funny, Cute, Survival, Action, Indie, 2D, Adventure"
880940,Pummel Party,"20 Sep, 2018","205.000,00₫",Very Positive,0.89,38449,"Multiplayer, Funny, Online Co-Op, 4 Player Local, Board Game, Party Game, Casual, Minigames, Local Multiplayer, Co-op, Party, Local Co-Op, Action, Indie, Comedy, Tabletop, Controller, Gore, Colorful, Singleplayer"
346110,ARK: Survival Evolved,"27 Aug, 2017","205.000,00₫",Very Positive,0.83,513499,"Open World Survival Craft, Survival, Multiplayer, Open World, Dinosaurs, Crafting, Building, Adventure, Base Building, Co-op, Action, First-Person, Sandbox, Massively Multiplayer, Singleplayer, Early Access, RPG, Dragons, Sci-fi, Indie"
1227890,Summer Memories,"14 Jun, 2020","188.000,00₫",Very Positive,0.92,14554,"Sexual Content, Nudity, Mature, Hentai, Pixel Graphics, Anime, FPS, RPG, Simulation, Multiple Endings, Visual Novel, Singleplayer, Time Management, 2D, JRPG, Adventure, RPGMaker, Indie, Funny, Memes"
1435790,Escape Simulator,"19 Oct, 2021","205.000,00₫",Very Positive,0.94,11975,"Puzzle, Co-op, Escape Room, Multiplayer, First-Person, Adventure, Mystery, Controller, Casual, Family Friendly, Indie, Singleplayer, Simulation, Online Co-Op, Story Rich, Point & Click, Level Editor, Exploration, Investigation, 3D"
291550,Brawlhalla,"17 Oct, 2017",Free,Very Positive,0.82,357789,"Free to Play, Multiplayer, Fighting, 2D Fighter, Casual, 2D Platformer, Local Multiplayer, Co-op, Controller, Action, Platformer, Fantasy, Online Co-Op, Local Co-Op, Family Friendly, 4 Player Local, Cartoony, eSports, Singleplayer, Indie"
1190000,Car Mechanic Simulator 2021,"11 Aug, 2021","321.000,00₫",Overwhelmingly Positive,0.96,22474,"Simulation, Automobile Sim, Sandbox, Realistic, Moddable, Racing, Driving, 3D, Education, First-Person, Singleplayer, Immersive Sim, Puzzle, Open World, Atmospheric, Adventure, Minigames, Indie, Strategy, Great Soundtrack"
2497920,A Difficult Game About Climbing,"6 Mar, 2024","142.000,00₫",Very Positive,0.88,1473,"Difficult, Precision Platformer, Psychological Horror, Physics, Funny, Parkour, Singleplayer, Indie, Platformer, Surreal, Third Person, Philosophical, Action, Survival, Linear, Nature, 2.5D, 2D Platformer, 2D"
457140,Oxygen Not Included,"30 Jul, 2019","220.000,00₫",Overwhelmingly Positive,0.96,105709,"Colony Sim, Base Building, Survival, Resource Management, Building, Singleplayer, Management, Simulation, 2D, Sandbox, Strategy, Space, Indie, Sci-fi, Exploration, Difficult, Open World, Multiplayer, Adventure, Space Sim"
1629520,A Little to the Left,8 nov. 2022,"165.000,00₫",Very Positive,0.91,6967,"Casse-tête, Détente, Bienveillant, Casual, Mignon, Coloré, Chats, Humour, 2D, Logique, Jeu solo, Dessiné à la main, Réconfortant, Indépendant, Objets cachés, Linéaire, Familial, Graphismes pixel, Pointer et cliquer, Multijoueur"
1826140,RimWorld - Biotech,"21 Oct, 2022","300.000,00₫",Very Positive,0.93,2374,"Indie, Strategy, Simulation, Colony Sim, Singleplayer, Moddable"
427520,Factorio,"14 Aug, 2020","450.000,00₫",Overwhelmingly Positive,0.97,143153,"Automation, Base Building, Resource Management, Sandbox, Crafting, Strategy, Multiplayer, Survival, Management, Open World, Building, Co-op, 2D, Moddable, Singleplayer, Trains, Simulation, Pixel Graphics, City Builder, Indie"
620980,Beat Saber,"21 May, 2019","385.000,00₫",Overwhelmingly Positive,0.95,65573,"VR, Rhythm, Music, Moddable, Fast-Paced, First-Person, Indie, Singleplayer, Difficult, Multiplayer, Swordplay, Action, Sports, Futuristic, Casual, Games Workshop, Music-Based Procedural Generation, PvP, Great Soundtrack, Early Access"
1057090,Ori and the Will of the Wisps,"10 Mar, 2020","250.000,00₫",Overwhelmingly Positive,0.96,115281,"Beautiful, Metroidvania, Platformer, Great Soundtrack, Singleplayer, Action, Adventure, Atmospheric, Story Rich, Exploration, Cute, Action-Adventure, Puzzle, Emotional, 2D, Difficult, Indie, Fantasy, Open World, Souls-like"
692890,Roboquest,"7 Nov, 2023","258.000,00₫",Overwhelmingly Positive,0.95,11394,"FPS, Action Roguelike, Roguelite, Co-op, Shooter, Online Co-Op, Fast-Paced, Looter Shooter, Post-apocalyptic, Bullet Hell, Action, Indie, Sci-fi, Stylized, Perma Death, Multiplayer, Colorful, First-Person, Singleplayer, Roguelike"
1244090,Sea of Stars,"28 Aug, 2023","445.000,00₫",Very Positive,0.88,7044,"RPG, Pixel Graphics, Turn-Based Combat, Adventure, JRPG, Story Rich, 2D, Turn-Based, Retro, Singleplayer, Fantasy, Indie, Lore-Rich, Funny, Comedy, Exploration, Colorful, Emotional, Female Protagonist, Kickstarter"
1217060,Gunfire Reborn,"17 Nov, 2021","260.000,00₫",Very Positive,0.93,79816,"Roguelite, FPS, Online Co-Op, Co-op, Roguelike, Multiplayer, Looter Shooter, Indie, Action, Adventure, RPG, Shooter, Action Roguelike, First-Person, Dungeon Crawler, Replay Value, Singleplayer, Early Access, Fast-Paced, Loot"
632470,Disco Elysium - The Final Cut,"15 Oct, 2019","310.000,00₫",Very Positive,0.93,82679,"RPG, Story Rich, Choices Matter, Detective, Isometric, Atmospheric, Singleplayer, CRPG, Point & Click, Noir, Surreal, Exploration, Political, Visual Novel, Adventure, Indie, Funny, Open World, Character Customization, Sexual Content"
1794680,Vampire Survivors,"20 Oct, 2022","70.000,00₫",Overwhelmingly Positive,0.98,215034,"Action Roguelike, Bullet Hell, Pixel Graphics, Roguelite, 2D, Indie, Vampire, Singleplayer, Casual, Arcade, Action, RPG, Controller, Retro, Score Attack, Roguelike, Action RPG, Dark Fantasy, Local Co-Op, 1980s"
379430,Kingdom Come: Deliverance,"13 Feb, 2018","499.500,00₫",Very Positive,0.82,90248,"Medieval, RPG, Open World, Singleplayer, Realistic, Historical, Story Rich, Adventure, First-Person, Swordplay, Action, Nudity, Choices Matter, Choose Your Own Adventure, Atmospheric, Horses, Action RPG, Indie, Crowdfunded, Kickstarter"
1222700,A Way Out,"18 Jun, 2020","700.000,00₫",Very Positive,0.85,39442,"Online Co-Op, Co-op, Split Screen, Story Rich, Local Co-Op, Action-Adventure, Multiplayer, Action, Adventure, Crime, Third Person, Emotional, Conversation, Atmospheric, Nudity, Cinematic, Sexual Content, Violent, Singleplayer, Indie"
477160,Human Fall Flat,"22 Jul, 2016","198.000,00₫",Very Positive,0.94,152043,"Co-op, Funny, Puzzle, Adventure, Physics, Sandbox, Action, Puzzle Platformer, Open World, Multiplayer, Local Co-Op, Indie, Comedy, Local Multiplayer, Parkour, Casual, Split Screen, 3D Platformer, Singleplayer, Simulation"
2004210,Euro Truck Simulator 2 - West Balkans,"19 Oct, 2023","249.000,00₫",Very Positive,0.83,1342,"Simulation, Indie, Driving, Multiplayer, Open World, Transportation, First-Person, Singleplayer, Automobile Sim, Realistic, Adventure, Moddable"
613100,House Flipper,"17 May, 2018","321.000,00₫",Very Positive,0.93,75686,"Simulation, Design & Illustration, Building, Singleplayer, Relaxing, Sandbox, Casual, Immersive Sim, Education, Management, First-Person, Economy, Family Friendly, Replay Value, Base Building, 3D, Realistic, Indie, Multiplayer, Moddable"
361420,ASTRONEER,"5 Feb, 2019","385.000,00₫",Very Positive,0.92,99254,"Multiplayer, Open World, Open World Survival Craft, Survival, Space, Exploration, Base Building, Co-op, Sandbox, Adventure, Building, Crafting, Sci-fi, Automation, Singleplayer, Colorful, Third Person, Atmospheric, Simulation, Indie"
1158160,Coral Island,"14 Nov, 2023","385.000,00₫",Very Positive,0.88,12508,"Farming Sim, Life Sim, Relaxing, Simulation, Dating Sim, Agriculture, RPG, Crafting, Building, Singleplayer, Character Customization, Sandbox, Open World, Casual, Adventure, Indie, Fishing, Mining, Cartoony, LGBTQ+"
1084600,My Time at Sandrock,"2 Nov, 2023","549.000,00₫",Very Positive,0.88,19200,"Life Sim, Building, Sandbox, Farming Sim, Crafting, Multiplayer, RPG, Dating Sim, Open World, Character Customization, Mining, Post-apocalyptic, Casual, Simulation, Adventure, Singleplayer, Female Protagonist, Cartoony, Early Access, Indie"
371970,Barony,"23 Jun, 2015","260.000,00₫",Very Positive,0.92,4848,"Action Roguelike, Dungeon Crawler, Fantasy, Co-op Campaign, Immersive Sim, Local Co-Op, First-Person, Online Co-Op, Split Screen, Co-op, RPG, Roguelike, Difficult, 4 Player Local, Action RPG, Pixel Graphics, Voxel, Singleplayer, Moddable, Indie"
1167630,Teardown,"21 Apr, 2022","445.000,00₫",Overwhelmingly Positive,0.95,80926,"Destruction, Physics, Sandbox, Voxel, First-Person, Singleplayer, Heist, Open World, Realistic, Simulation, 3D, Action, Puzzle, Driving, Indie, Tactical, Replay Value, Immersive Sim, Puzzle Platformer, Runner"
244850,Space Engineers,"28 Feb, 2019","260.000,00₫",Very Positive,0.89,91361,"Space, Sandbox, Building, Open World Survival Craft, Multiplayer, Survival, Simulation, Open World, Physics, Crafting, Destruction, Co-op, Futuristic, Indie, Sci-fi, Singleplayer, Action, Strategy, Adventure, Early Access"
